index,published,keyword,domain,language,valid,title,description,url,image,archive,content,quote,de,en,la,added
86caa4722f8a0954b01592fabee5d161,2025-11-06T19:10:03Z,'heat wave',phys.org,en,0.0,Asian summer monsoon's unusual role in 2021 Pacific Northwest heat wave revealed,"In recent years, as extreme weather events have occurred with increasing frequency, scientists have been searching within the chaotic atmospheric system for clues that can enhance forecasting capabilities—factors such as ENSO, sea ice, the stratospheric polar…",https://phys.org/news/2025-11-asian-summer-monsoon-unusual-role.html,https://scx2.b-cdn.net/gfx/news/hires/2025/can-it-vs-did-it-new-s.jpg,,"In recent years, as extreme weather events have occurred with increasing frequency, scientists have been searching within the chaotic atmospheric system for clues that can enhance forecasting capabil… [+5024 chars]",,"Die ungewöhnliche Rolle des asiatischen Sommermonsuns bei der Hitzewelle im pazifischen Nordwesten 2021 wurde enthüllt. Da extreme Wetterereignisse in den letzten Jahren immer häufiger auftraten, haben Wissenschaftler innerhalb des chaotischen atmosphärischen Systems nach Hinweisen gesucht, die die Vorhersagefähigkeiten verbessern können – Faktoren wie ENSO, Meereis, die stratosphärische Polarregion …","Asian summer monsoon's unusual role in 2021 Pacific Northwest heat wave revealed. In recent years, as extreme weather events have occurred with increasing frequency, scientists have been searching within the chaotic atmospheric system for clues that can enhance forecasting capabilities—factors such as ENSO, sea ice, the stratospheric polar…","ETESIA Asiana Aestivalis munus insolitum anno 2021 Pacifici Northwest caloris undae revelavit. Superioribus annis, sicut eventus extremae tempestatis crebrioribus evenerunt, phisici intra systema tenebrarum atmosphaericum quaesiverunt extare quae facultatem praevidere possunt augere factores, quales sunt ENSO, glacies marina, polaris stratospherici.",2025-10-24 08:10:13+00:00
ed64db2829eab3bda4c852a3a43e706d,2025-11-01T00:00:45Z,'+warm spell',gizmodo.com,en,0.1,A Monstrously Alluring Secret Comes to Light in This Eerie Short Story,"October's Lightspeed short story is 'Drosera regina' by A.L. Goldfuss, and it's perfect Halloween reading.",https://gizmodo.com/a-woman-hides-a-monstrously-alluring-secret-in-this-eerie-short-story-2000680209,https://gizmodo.com/app/uploads/2025/10/OCT2025_Lightspeed_io9-1200x675.jpg,,"io9 is proud to present fiction from Lightspeed Magazine. Once a month, we feature a story from Lightspeeds current issue. This months selection is Drosera regina by A.L. Goldfuss. Enjoy!
Drosera re… [+36812 chars]",,In dieser unheimlichen Kurzgeschichte kommt ein ungeheuer verlockendes Geheimnis ans Licht. Die Lightspeed-Kurzgeschichte im Oktober ist „Drosera regina“ von A.L. Goldfuss und die perfekte Halloween-Lektüre.,"A Monstrously Alluring Secret Comes to Light in This Eerie Short Story. October's Lightspeed short story is 'Drosera regina' by A.L. Goldfuss, and it's perfect Halloween reading.","Monstrum alludens, Secret venit in lucem in hac superstitio Brevis narratio. October's Lightspeed brevis narratio est 'Drosera regina' ab A.L. Goldfuss, et perfecta est lectio Halloween.",2025-10-24 08:10:13+00:00
815a17f3ceaa27a03978ec07139eae58,2025-11-01T06:00:00Z,'heat air condition',www.bay12games.com,en,0.1,11/01/2025,"(Toady One) Ah, last month was quiet since I was a bit absorbed in the work and testing - siege update is in two days, on November 3rd! Here is 

a monthly report.

 Here also is 

a Future of the Fortress reply.",http://www.bay12games.com/dwarves/index.html#2025-11-01,,,"<li>11/01/2025 Ah, last month was quiet since I was a bit absorbed in the work and testing - siege update is in two days, on November 3rd! Here is a monthly report. Here also is a Future of the Fortr… [+188195 chars]",,"01.11.2025. (Toady One) Ah, der letzte Monat war ruhig, da ich etwas in die Arbeit und das Testen vertieft war – das Siege-Update kommt in zwei Tagen, am 3. November! Hier ist 

ein monatlicher Bericht.

 Auch hier ist 

eine Antwort auf die Zukunft der Festung.","11/01/2025. (Toady One) Ah, last month was quiet since I was a bit absorbed in the work and testing - siege update is in two days, on November 3rd! Here is 

a monthly report.

 Here also is 

a Future of the Fortress reply.","11/01/2025. Ah, mensis ultimus quievit ex quo labore et probatione aliquantulum intentus eram - renovatio obsidionis est duobus diebus, III Nonas Novembres! Hic est 

menstruam famam.

 Hic quoque est 

de Futuro Arce responsum.",2025-10-24 08:10:13+00:00
a280872de9ef909ff970a160660c297e,2025-11-01T07:12:00Z,'heat drink',greeknetwork.gr,en,0.1,The Art of Greek Coffee Culture: Conversations That Last Hours,"In Greece, coffee isn’t just a drink — it’s a way of life. Whether sipped slowly at a seaside café or enjoyed in a quiet village square, coffee brings people together. It’s a symbol of friendship, hospitality, and conversation. To understand Greek life, you n…",https://greeknetwork.gr/2025/11/01/the-art-of-greek-coffee-culture-conversations-that-last-hours/,https://greeknetwork.gr/wp-content/uploads/2025/11/greek-coffee.jpeg,,"In Greece, coffee isnt just a drink its a way of life. Whether sipped slowly at a seaside café or enjoyed in a quiet village square, coffee brings people together. Its a symbol of friendship, hospita… [+3358 chars]",,"Die Kunst der griechischen Kaffeekultur: Gespräche, die stundenlang dauern. In Griechenland ist Kaffee nicht nur ein Getränk – es ist eine Lebensart. Ob langsam in einem Café am Meer schlürfend oder auf einem ruhigen Dorfplatz genossen, Kaffee bringt Menschen zusammen. Es ist ein Symbol für Freundschaft, Gastfreundschaft und Konversation. Um das griechische Leben zu verstehen, müssen Sie …","The Art of Greek Coffee Culture: Conversations That Last Hours. In Greece, coffee isn’t just a drink — it’s a way of life. Whether sipped slowly at a seaside café or enjoyed in a quiet village square, coffee brings people together. It’s a symbol of friendship, hospitality, and conversation. To understand Greek life, you n…","Ars Graeca Coffee Culturae: Colloquia ultimae Horae. In Graecia, capulus potus non est — via vitae est. Utrum lente in litore maris sorbilia an in platea quieto vico gaudeant, capulus homines in unum colligit. Signum est amicitiae, hospitalitatis, conversationis. Graecam vitam intellegere, n…",2025-10-24 08:10:13+00:00
782cb4eb2baab9e00fa814ba0f0a21b3,2025-11-01T08:00:00Z,'heat drink',theweek.com,en,0.1,Salted caramel and chocolate tart recipe,Delicious dessert can be made with any biscuits you fancy,https://theweek.com/culture-life/food-drink/salted-caramel-and-chocolate-tart-recipe,https://cdn.mos.cms.futurecdn.net/gkcmCdQhrxCLVNkXeEGr84-2000-80.jpg,,"This has to be one of the easiest, most decadent desserts you’ll ever make, says Poppy O’Toole. I picked it up when working in the kitchens of a bank: for big events it would be our go-to sweet treat… [+2345 chars]",,Rezept für eine Torte mit gesalzenem Karamell und Schokolade. Ein köstlicher Nachtisch kann mit den Keksen Ihrer Wahl zubereitet werden,Salted caramel and chocolate tart recipe. Delicious dessert can be made with any biscuits you fancy,Carmeli et salsis consequat scelerisque tard. Delectamentum mensa aliqua tortulas tibi placeas fieri,2025-10-24 08:10:13+00:00
3bb0fb3cdc3069d34e679c12d42a921a,2025-11-01T08:00:00Z,'heat climate change',www.cbc.ca,en,0.1,How much of a role did climate change play with Hurricane Melissa?,"Millions of people across the Caribbean are trying to deal with the devastating effects of Hurricane Melissa, which tore through the region this week, slamming into Jamaica as a Category 5 storm. Now, several groups have done a rapid analysis to determine wha…",https://www.cbc.ca/news/science/hurricane-melissa-climate-change-9.6960554,"https://i.cbc.ca/ais/fa41c082-3508-4705-b172-cf746f756752,1761854107929/full/max/0/default.jpg?im=Crop%2Crect%3D%280%2C186%2C2805%2C1577%29%3BResize%3D620",,"Millions of people across the Caribbean are trying to deal with the devastating effects of Hurricane Melissa, which tore through the region this week.
Like so many storms of late, Melissa underwent … [+5041 chars]",,"Welche Rolle spielte der Klimawandel beim Hurrikan Melissa? Millionen Menschen in der gesamten Karibik kämpfen mit den verheerenden Auswirkungen des Hurrikans Melissa, der diese Woche über die Region hinwegfegte und Jamaika als Sturm der Kategorie 5 traf. Nun haben mehrere Gruppen eine Schnellanalyse durchgeführt, um festzustellen, was…","How much of a role did climate change play with Hurricane Melissa?. Millions of people across the Caribbean are trying to deal with the devastating effects of Hurricane Melissa, which tore through the region this week, slamming into Jamaica as a Category 5 storm. Now, several groups have done a rapid analysis to determine wha…","Quantum de munere climatis mutationem fecit cum Hurricane Melissa? Decies hominum trans Caribbean agere conantur cum effectibus vastitatis Melissae Hurricanae, quae hac septimana per regionem disruperunt, in Iamaicam tamquam Categoriam 5 expugnaverunt. Nunc, plures coetus celeri analysi egerunt ad determinare quid ...",2025-10-24 08:10:13+00:00
1f938dcd5cf8601239cded07081720cb,2025-11-01T09:00:34Z,'+warm spell',bengreenfieldlife.com,en,0.1,"Exercising One Specific (Often Forgotten) Body Part Can Relieve Aching Tightness, Head-Splitting Migraines, Breathing Issues, and Poor Sleep Quality With Dr. Neel Bulchandani (Best of LIFE Network’s Experts!)","Listen on: Reading time: 6 minutes What I Discuss with Dr. Neel Bulchandani Unique body adjustment techniques involving the mouth
The post Exercising One Specific (Often Forgotten) Body Part Can Relieve Aching Tightness, Head-Splitting Migraines, Breathing Is…",https://bengreenfieldlife.com/podcast/lnneel/,https://bengreenfieldlife.com/wp-content/uploads/2025/11/LN-Replay-Dr-Neel-WP.png,,"Ben Greenfield [00:00:00]: You're about to hear replay with our valued life network in house expert Dr. Neil Bolchandani, a chiropractor whose tongue, mouth and organ techniques absolutely blew my mi… [+74592 chars]",,"Das Training eines bestimmten (oft vergessenen) Körperteils kann mit Dr. Neel Bulchandani (Experten von Best of LIFE Network!) schmerzende Verspannungen, kopfzerreißende Migräne, Atemprobleme und schlechte Schlafqualität lindern. Hören Sie zu: Lesezeit: 6 Minuten Was ich mit Dr. Neel Bulchandani bespreche Einzigartige Techniken zur Körperanpassung unter Einbeziehung des Mundes
Der Beitrag Das Training eines bestimmten (oft vergessenen) Körperteils kann schmerzende Verspannungen, kopfspaltende Migräne und Atmung lindern …","Exercising One Specific (Often Forgotten) Body Part Can Relieve Aching Tightness, Head-Splitting Migraines, Breathing Issues, and Poor Sleep Quality With Dr. Neel Bulchandani (Best of LIFE Network’s Experts!). Listen on: Reading time: 6 minutes What I Discuss with Dr. Neel Bulchandani Unique body adjustment techniques involving the mouth
The post Exercising One Specific (Often Forgotten) Body Part Can Relieve Aching Tightness, Head-Splitting Migraines, Breathing Is…","Exercitium Imprimis (Saepe Forgotten) Corpus Partis Can Relieve Aching Tightness, Head-Splitting Migraines, Respirationes Exitus, et Pauper Somnus Quality With Dr. Neel Bulchandani (Best of life Network's Experts!). Audi: Lectio tempus: 6 minuta Quae Disputo cum Dr. Neel Bulchandani Unique corporis technicis technicis oris quae obstringuntur
Post Exercens Imprimis (Saepe Oblitus) Corpus Partem sublevare potest Traiecto Rectitudo, Capitis Scinditur Migraines, Spiratio…",2025-10-24 08:10:13+00:00
061a09795af43fcbe97584c856691e15,2025-11-01T15:43:35Z,'heat drink',www.foxsports.com,en,0.1,"Top 10 Names in College Football: Rob Gronkowski, Dave Portnoy Reveal Their List","Dave Portnoy and Rob Gronkowski brought the laughs and the heat on Saturday’s ""Big Noon Kickoff"" as they unveiled their “Top 10 Names in College Football"" list.",https://www.foxsports.com/stories/college-football/top-10-names-college-football-rob-gronkowski-dave-portnoy-reveal-list,https://a57.foxsports.com/statics.foxsports.com/www.foxsports.com/content/uploads/2025/11/1408/814/names-2.jpg?ve=1&tl=1,,"Dave Portnoy and Rob Gronkowski brought the laughs and the heat on Saturdays ""Big Noon Kickoff"" as they unveiled their ""Top 10 Names in College Football"" list.
From clever wordplay to pure chaos, th… [+1947 chars]",,"Top-10-Namen im College-Football: Rob Gronkowski und Dave Portnoy enthüllen ihre Liste. Dave Portnoy und Rob Gronkowski sorgten beim „Big Noon Kickoff“ am Samstag für Lacher und Hitze, als sie ihre Liste der „Top 10 Namen im College-Football“ enthüllten.","Top 10 Names in College Football: Rob Gronkowski, Dave Portnoy Reveal Their List. Dave Portnoy and Rob Gronkowski brought the laughs and the heat on Saturday’s ""Big Noon Kickoff"" as they unveiled their “Top 10 Names in College Football"" list.","Top 10 Names in College Football: Rob Gronkowski, Dave Portnoy Reveal Their List. Dave Portnoy et Rob Gronkowski ludibria et aestus in die Saturni ""Big Noon Kickoff"" attulerunt, ut suas ""Top 10 Nomina in Collegio Football"" album detexerunt.",2025-10-24 08:10:13+00:00
bada53327b4523b698bcabd57e708613,2025-11-01T17:00:00Z,'heat drink',robbreport.com,en,0.1,"How to Make a Fall Back, the Manhattan That’s Built for Autumn",This drink created by legendary bartender Sasha Petraske has a little apple brandy that helps it capture the flavors of the season.,http://robbreport.com/food-drink/spirits/best-fall-back-recipe-rye-whiskey-apple-brandy-1237337931/,https://robbreport.com/wp-content/uploads/2025/11/fall-back-rye-whiskey-cocktail.jpg?w=681&h=383&crop=1,,"This Sunday, all our clocks are going to “fall back,” which is to say, we get one extra hour of sleep. This is generally regarded as good news. I, by contrast, do not think this is good news. Because… [+5427 chars]",,"Wie man einen Rückzugsort schafft, das Manhattan, das für den Herbst gebaut wurde. Dieses von der legendären Barkeeperin Sasha Petraske kreierte Getränk enthält etwas Apfelschnaps, der dabei hilft, die Aromen der Saison einzufangen.","How to Make a Fall Back, the Manhattan That’s Built for Autumn. This drink created by legendary bartender Sasha Petraske has a little apple brandy that helps it capture the flavors of the season.","Quomodo Fall Back, Manhattan Id pro Autumno aedificatum est. Hoc potum a fabuloso ministro Sasha Petraske creatum habet modicum pomum sublimatum quod adiuvat ut sapores temporis capiat.",2025-10-24 08:10:13+00:00
29331813d7ace48a8e433cfd3b2871d9,2025-11-01T17:19:00Z,'heat drink',clarkesworldmagazine.com,en,0.1,Prerequisites for the Creation of a Possible Predicted World by Chisom Umeh,"Akintunde Salami stood close to the floor-to-ceiling window inside the dome, watching the simulator work. This wasn’t the first time he had witnessed the minutiae of the world-shaping AI, Palm, […]",https://clarkesworldmagazine.com/umeh_11_25/,https://clarkesworldmagazine.com/covers/cw_230_800.jpg?3,,"Akintunde Salami stood close to the floor-to-ceiling window inside the dome, watching the simulator work. This wasn’t the first time he had witnessed the minutiae of the world-shaping AI, Palm, or wa… [+27064 chars]",,"Voraussetzungen für die Schaffung einer möglichen vorhergesagten Welt von Chisom Umeh. Akintunde Salami stand dicht am raumhohen Fenster in der Kuppel und beobachtete die Arbeit des Simulators. Dies war nicht das erste Mal, dass er Zeuge der Details der weltgestaltenden KI Palm wurde, […]","Prerequisites for the Creation of a Possible Predicted World by Chisom Umeh. Akintunde Salami stood close to the floor-to-ceiling window inside the dome, watching the simulator work. This wasn’t the first time he had witnessed the minutiae of the world-shaping AI, Palm, […]","PRAEREQUISITIS PRO Creatione Mundi Praedicti Possibilis per Chisom Umeh. Akintunde Salami prope fenestram stabat ad pavimentum-ad-laqueatum in medio testudine, opus simulatorem spectans. Hoc non erat primum minutias figurationis mundi AI, Palm, testatus […]",2025-10-24 08:10:13+00:00
cbdb4685e88fcf5b267fe2d1c9e64e81,2025-11-01T17:19:19Z,'heat drink',clarkesworldmagazine.com,en,0.1,The Apologists by Tade Thompson,"1. THE MURDER CHAPTER ONE A dual-carriage road descends from a flyover bridge in Thamesmead, bearing sluggish traffic on both sides. From inside bus number 229, a woman looks out […]",https://clarkesworldmagazine.com/thompson_11_25/,https://clarkesworldmagazine.com/covers/cw_230_800.jpg?3,,"1. THE MURDER
CHAPTER ONE
A dual-carriage road descends from a flyover bridge in Thamesmead, bearing sluggish traffic on both sides. From inside bus number 229, a woman looks out of the large windo… [+120246 chars]",,Die Apologeten von Tade Thompson. 1. DER MORD KAPITEL EINS Eine zweispurige Straße führt von einer Überführungsbrücke in Thamesmead hinunter und ist auf beiden Seiten von schleppendem Verkehr geprägt. Aus dem Bus Nr. 229 schaut eine Frau hinaus […],"The Apologists by Tade Thompson. 1. THE MURDER CHAPTER ONE A dual-carriage road descends from a flyover bridge in Thamesmead, bearing sluggish traffic on both sides. From inside bus number 229, a woman looks out […]","Apologistae per Tade Thompson. 1. DE CAEDO CAPITULUM I. Iter duplicale vehiculum descendens a ponte Volatorio in Thamesmead, pigrum utrinque commercium gerens. Bus numero 229 intus, femina prospicit […]",2025-10-24 08:10:13+00:00
36d4ce3ccd7cad5f07815c8834462d18,2025-11-01T23:45:00Z,'heat drink',www.yahoo.com,en,0.1,Aldi celebrates game-changing new policy for customers: 'I'm delighted',"""We have significantly invested in the scheme since it launched.""",https://www.yahoo.com/news/articles/aldi-celebrates-game-changing-policy-234500328.html,https://s.yimg.com/ny/api/res/1.2/iV87__6QCBzF2n0v6sumqA--/YXBwaWQ9aGlnaGxhbmRlcjt3PTEyMDA7aD04MDA7Y2Y9d2VicA--/https://media.zenfs.com/en/the_cool_down_737/8666058940d443a4af4f99d64351beea,,"International grocery store chain Aldi is celebrating a massive policy win after it helped give Irish shoppers millions of euros back.
According to Checkout, the company's reverse vending machines h… [+2672 chars]",,Aldi feiert bahnbrechende neue Richtlinie für Kunden: „Ich bin begeistert.“ „Wir haben seit seiner Einführung erheblich in das Programm investiert.“,"Aldi celebrates game-changing new policy for customers: 'I'm delighted'. ""We have significantly invested in the scheme since it launched.""","Aldi celebrat ludum mutans novum consilium clientium: 'Gaudeo'. ""Notabiliter investivimus in schemate cum deflexit.""",2025-10-24 08:10:13+00:00
a20ffb3324897d6de5cc52e51ac77154,2025-11-02T02:49:04Z,'+warm spell',bleedingcool.com,en,0.1,"CM Punk Makes History, Wins Title at Saturday Night's Main Event","Auughh man!  The Chadster just witnessed pure wrestling excellence last night on WWE Saturday Night's Main Event, and The Chadster is still literally shaking with excitement! ✨ CM Punk defeated Jey Uso to become the new World Heavyweight Champion, a…",https://bleedingcool.com/tv/cm-punk-makes-history-wins-title-at-saturday-nights-main-event/,https://bleedingcool.com/wp-content/uploads/2025/11/MixCollage-01-Nov-2025-10-38-PM-9978.jpg,,"Posted in: Sports, TV, WWE | Tagged: recaps, wrestling, WWE Saturday Night's Main Event
The Chadster reviews WWE Saturday Night's Main Event where CM Punk won the World Heavyweight Championship! Ton… [+10435 chars]",,"CM Punk schreibt Geschichte und gewinnt den Titel beim Main Event am Samstagabend. Auughh Mann!  Der Chadster wurde gestern Abend beim WWE Saturday Night's Main Event Zeuge purer Wrestling-Exzellenz und zittert immer noch buchstäblich vor Aufregung! ✨ CM Punk besiegte Jey Uso und wurde der neue Weltmeister im Schwergewicht, ein…","CM Punk Makes History, Wins Title at Saturday Night's Main Event. Auughh man!  The Chadster just witnessed pure wrestling excellence last night on WWE Saturday Night's Main Event, and The Chadster is still literally shaking with excitement! ✨ CM Punk defeated Jey Uso to become the new World Heavyweight Champion, a…","CM Punk Historiam facit, titulum vincit in Saturni Event praecipuum Noctis. Auughh homo!  The Chadster iustus testatus est meram luctandi excellentiam heri in WWE Nocte Diei principali Eventus, et Chadster adhuc literam commotionem concitavit! ✨ CM Punk victus Jey Uso ut novus Mundus Gravis Champion, a…",2025-10-24 08:10:13+00:00
f86c54ecd06aed8b9171846cc05d5d06,2025-11-02T05:00:00Z,'heat drink',www.abc.net.au,en,0.1,No-one misses out: Easy and delicious low and no-alcohol drinks,"Having a range of drinks on offer can help everyone feel included, especially at end-of-year gatherings.",https://www.abc.net.au/news/2025-11-02/low-alcohol-cocktails-and-non-alcoholic-drinks-mocktails/105763344,https://live-production.wcms.abc-cdn.net.au/6dad3d359609874da444175f8c823f34?impolicy=wcms_watermark_news&cropH=968&cropW=1720&xPos=0&yPos=88&width=862&height=485&imformat=generic,,"Having a range of drinks on offer at end-of-year gatherings can help everyone feel included.
Here's our round-up of non-alcoholic drinks and cocktails that use less alcohol.
Non-alcoholic drinks 
… [+4379 chars]",,"Niemand lässt sich etwas entgehen: Einfache und köstliche alkoholarme und alkoholfreie Getränke. Ein vielfältiges Getränkeangebot kann dazu beitragen, dass sich alle einbezogen fühlen, insbesondere bei Zusammenkünften zum Jahresende.","No-one misses out: Easy and delicious low and no-alcohol drinks. Having a range of drinks on offer can help everyone feel included, especially at end-of-year gatherings.","Nullo caret: Securus et deliciosus humilis et nullus bibit arcu. Singulas potiones in offerendo iuvare possunt omnes inclusos sentire, praesertim in fine-annorum conventibus.",2025-10-24 08:10:13+00:00
d6f3aceab791ab946ef0323fb51da7fc,2025-11-02T07:00:00Z,'+heat climate change',www.cnet.com,en,0.1,Why Your Electrical Panel Might Not be Ready for a Heat Pump,Heat pumps are energy-efficient and reduce emissions; we turned to experts to determine if one will work in your home.,https://www.cnet.com/home/energy-and-utilities/can-your-electrical-panel-handle-a-heat-pump/,https://www.cnet.com/a/img/resize/feed685ca688bbccc2c5d6f31bd90ac8e2fa25f2/hub/2025/01/22/bd2ee3c5-7f76-480a-9215-2fe425da0605/gettyimages-1140571804.jpg?auto=webp&fit=crop&height=675&width=1200,,"As energy costs continue to climb and extreme weather conditions caused by climate change push homeowners toward cleaner and more efficient heating and cooling solutions, heat pumps have emerged as a… [+6571 chars]",,"Warum Ihr Schaltschrank möglicherweise nicht für eine Wärmepumpe geeignet ist. Wärmepumpen sind energieeffizient und reduzieren Emissionen; Wir haben uns an Experten gewandt, um herauszufinden, ob dies bei Ihnen zu Hause funktioniert.",Why Your Electrical Panel Might Not be Ready for a Heat Pump. Heat pumps are energy-efficient and reduce emissions; we turned to experts to determine if one will work in your home.,Cur tua Electrical Panel Promptus ad Calorem Pump non posset. Calor soleatus sunt energiae efficaces et emissiones minuendae; peritis conversi sumus ut determinare si quis in domo tua laborabit.,2025-10-24 08:10:13+00:00
fcb0cfe681586b78e683855d0ca27132,2025-11-02T08:44:03Z,'heat drink',www.cnet.com,en,0.1,Am I Eating Plastic? 4 Kitchen Items That May Be Filling My Food With Microplastics,"I discovered that tea bags, an air fryer and other kitchen items could be adding microplastics to my food.",https://www.cnet.com/health/am-i-eating-plastic-4-kitchen-items-that-may-be-filling-my-food-with-microplastics/,https://www.cnet.com/a/img/resize/158651e3f0df0ef5c9df00af4b8bac5e763c5694/hub/2025/10/21/50303a78-59c6-48c1-8fc5-bbfa84982080/microplastic-kitchen-6.jpg?auto=webp&fit=crop&height=675&width=1200,,"It's no longer uncommon to find microplastics inside the human body. In fact, it has been estimated that Americans consume between 39,000 and 52,000 microplastic particles per year. This can be from … [+7403 chars]",,"Esse ich Plastik? 4 Küchenartikel, die mein Essen möglicherweise mit Mikroplastik füllen. Ich entdeckte, dass Teebeutel, eine Heißluftfritteuse und andere Küchenutensilien meinem Essen Mikroplastik hinzufügen könnten.","Am I Eating Plastic? 4 Kitchen Items That May Be Filling My Food With Microplastics. I discovered that tea bags, an air fryer and other kitchen items could be adding microplastics to my food.","Sumne Plastic edo? 4 Item coquina quae impleant cibum meum cum Microplastics. Deprehendi sacculos tea, globulos aereos et alia coquina vasa microplastica meo cibario addere posse.",2025-10-24 08:10:13+00:00
