index,published,keyword,domain,language,valid,title,description,url,image,archive,content,quote,de,en,la,added
5daaeaa1568fa0741effd5dbf0211999,2025-11-09T12:57:01Z,'+heat climate change',indianexpress.com,en,0.1,"UPSC Key: National Legal Services Day, Leaders’ Summit of COP30, and Landfills","Why is the Leaders’ Summit of COP30 important for your UPSC exam? What significance do topics such as net-zero emissions, Mid-Day Meal Scheme, and regional variations in HIV prevalence hold for both the Prelims and Main examinations? You can learn more by rea…",https://indianexpress.com/article/upsc-current-affairs/upsc-key-legal-services-day-leaders-summit-cop30-landfills-10355271/,https://images.indianexpress.com/2025/11/national-conference-on-strengthening-legal-aid_Modi.jpg,,"Preliminary Examination: Current events of national and international importance
Mains Examination: General Studies-II: Government policies and interventions for development in various sectors and i… [+27941 chars]",,"UPSC-Schlüssel: National Legal Services Day, Gipfeltreffen der Staats- und Regierungschefs der COP30 und Deponien. Warum ist der Leaders‘ Summit der COP30 für Ihre UPSC-Prüfung wichtig? Welche Bedeutung haben Themen wie Netto-Null-Emissionen, Mittagsverpflegung und regionale Unterschiede in der HIV-Prävalenz sowohl für die Vor- als auch für die Hauptprüfung? Sie können mehr erfahren, indem Sie …","UPSC Key: National Legal Services Day, Leaders’ Summit of COP30, and Landfills. Why is the Leaders’ Summit of COP30 important for your UPSC exam? What significance do topics such as net-zero emissions, Mid-Day Meal Scheme, and regional variations in HIV prevalence hold for both the Prelims and Main examinations? You can learn more by rea…","UPSC Key: National Services Day, Duces Summi COP30 et Landfills. Cur princeps culmen COP30 momenti pro UPSC examis tuis est? Quid significant thema qualia sunt emissiones reticularium, medium diei farinae Schema, et variationes regionales in HIV praevalentia tam Praelims quam examinibus principalibus tenent? Plus discere potes a rea ​​...",2025-10-24 08:10:13+00:00
4acc6b327fc5744893a2077ba07c060c,2025-11-09T13:30:00Z,'+heat climate change',www.motherjones.com,en,0.1,Donald Trump’s Dream of an Alaskan Oil Boom Is Feeling More Like a Bust,"This story was originally published by Grist and is reproduced here as part of the Climate Desk collaboration. As Kristen Moreland waited for the livestream to buffer, her thoughts drifted to the years she’d devoted to defending Arctic National Wildlife Refug…",https://www.motherjones.com/politics/2025/11/donald-trump-alaska-oil-drilling-mining-arctic-national-wildlife-refuge-ambler-road/,https://www.motherjones.com/wp-content/uploads/2025/11/Arctic-National-Wildlife-Refuge-ANWR-Alaska-drilling-oil-Trump-02.webp?w=1200&h=630&crop=1,,"A Gwich'in hunter keeps an eye out for the Porcupine caribou herd just outside the Arctic National Wildlife Refuge in Alaska.Emily Sullivan/Gwich'in Steering Committee
Get your news from a source th… [+11946 chars]",,"Donald Trumps Traum von einem Ölboom in Alaska fühlt sich eher wie eine Pleite an. Diese Geschichte wurde ursprünglich von Grist veröffentlicht und wird hier im Rahmen der Zusammenarbeit mit Climate Desk wiedergegeben. Während Kristen Moreland darauf wartete, dass der Livestream verstummte, wanderten ihre Gedanken zu den Jahren, die sie der Verteidigung des Arctic National Wildlife Refuge gewidmet hatte …","Donald Trump’s Dream of an Alaskan Oil Boom Is Feeling More Like a Bust. This story was originally published by Grist and is reproduced here as part of the Climate Desk collaboration. As Kristen Moreland waited for the livestream to buffer, her thoughts drifted to the years she’d devoted to defending Arctic National Wildlife Refug…","Donald Trump's Somnium olei Alaskan Boom Sentit Plus Similis Bust. Haec fabula a Grist primo divulgata est atque hic ut pars cooperationis Desk Climati repraesentetur. Cum Kristen Moreland exspectavit livestream opponere, cogitationes eius annis defluebant quas defenderet Refugium arcticum Nationale Wildlife…",2025-10-24 08:10:13+00:00
2588a4e459bf58e283079aa9f37651fc,2025-11-09T13:50:14Z,'heat stroke',bringatrailer.com,en,0.1,2022 Vespa 946 Christian Dior Limited Edition at No Reserve,"This 2022 Vespa 946 Christian Dior is one of 946 Limited Edition examples produced for the worldwide market, and this one was acquired by the seller on BaT in September 2025. Power comes from an air-cooled 155cc four-stroke single paired with a CVT transmissi…",https://bringatrailer.com/listing/2022-vespa-946-4/,https://bringatrailer.com/wp-content/uploads/2025/10/2022_vespa_946_2022_vespa_946_689f35fa-067b-4a8f-bf0c-dc3890e2fba4-ldv1m2-13032-32985.jpg,,"This 2022 Vespa 946 Christian Dior is one of 946 Limited Edition examples produced for the worldwide market, and this one was acquired by the seller on BaT in September 2025. Power comes from an air-… [+2485 chars]",,"2022 Vespa 946 Christian Dior Limited Edition ohne Reservierung. Diese Vespa 946 Christian Dior aus dem Jahr 2022 ist eines von 946 Exemplaren in limitierter Auflage, die für den weltweiten Markt produziert wurden, und dieses Exemplar wurde im September 2025 vom Verkäufer auf BaT erworben. Die Kraft kommt von einem luftgekühlten 155-cm³-Viertakt-Einzelmotor, gepaart mit einem CVT-Getriebe …","2022 Vespa 946 Christian Dior Limited Edition at No Reserve. This 2022 Vespa 946 Christian Dior is one of 946 Limited Edition examples produced for the worldwide market, and this one was acquired by the seller on BaT in September 2025. Power comes from an air-cooled 155cc four-stroke single paired with a CVT transmissi…","2022 Vespa 946 Dior Limited Edition at No Reserve. Hoc 2022 Vespa 946 Dior Christianus unus ex 946 Limited Editionis exempla pro mercato mundo produxit, et haec una a venditore acquisita est mense Septembri anni 2025. Potestas ex aere refrigerato 155cc quattuor ictu uno paribus CVT transmissi venit.",2025-10-24 08:10:13+00:00
e2303df67ce6ad25870fea8fc3574760,2025-11-09T14:23:56Z,'+heat climate change',www.yahoo.com,en,0.1,Landmark Paris Agreement set a path to slow warming. The world hasn't stayed on it,"The world has changed dramatically in the decade since leaders celebrated a historic climate agreement in Paris a decade ago, but not quite in ways they...",https://www.yahoo.com/news/articles/landmark-paris-agreement-set-path-142356581.html,https://s.yimg.com/ny/api/res/1.2/D3PSdIhUcL1.7aFlo1F.Ag--/YXBwaWQ9aGlnaGxhbmRlcjt3PTEyMDA7aD04MDA7Y2Y9d2VicA--/https://media.zenfs.com/en/ap.org/eeb5e4c42cd32d8b7a808c4c08a44c16,,"The world has changed dramatically in the decade since leaders celebrated a historic climate agreement in Paris a decade ago, but not quite in ways they expected or wanted.
Earth's warming climate h… [+6792 chars]",,"Das wegweisende Pariser Abkommen hat den Weg zur Verlangsamung der Erwärmung geebnet. Die Welt ist nicht dabei geblieben. Die Welt hat sich in dem Jahrzehnt, seit die Staats- und Regierungschefs vor einem Jahrzehnt in Paris ein historisches Klimaabkommen feierten, dramatisch verändert, aber nicht ganz in der Weise, wie sie...","Landmark Paris Agreement set a path to slow warming. The world hasn't stayed on it. The world has changed dramatically in the decade since leaders celebrated a historic climate agreement in Paris a decade ago, but not quite in ways they...","Terminum Paris Pactum iter ad tardus calefactionem posuit. Mundus in eo non mansit. Mundus dramatically mutatus est decennium ex quo principes conventionem climatis historici Lutetiae decennium celebraverunt, sed non admodum modis.",2025-10-24 08:10:13+00:00
454b3ec4f4cabc1d01e6e895baae2112,2025-11-09T15:49:40Z,'+heat climate change',abcnews.go.com,en,0.1,Landmark Paris Agreement set a path to slow warming. The world hasn't stayed on it,The world has seen faster climate change than expected since the Paris Agreement a decade ago,https://abcnews.go.com/Technology/wireStory/landmark-paris-agreement-set-path-slow-warming-world-127352278,https://i.abcnewsfe.com/a/bd74399b-7838-4a2b-8ff7-3d192dbc3456/wirestory_d56626cd6f7f1f8e5c1a9afbde9d5198_16x9.jpg?w=1600,,"The world has changed dramatically in the decade since leaders celebrated a historic climate agreement in Paris a decade ago, but not quite in ways they expected or wanted. 
Earth's warming climate … [+6730 chars]",,Das wegweisende Pariser Abkommen hat den Weg zur Verlangsamung der Erwärmung geebnet. Die Welt ist nicht dabei geblieben. Seit dem Pariser Abkommen vor einem Jahrzehnt hat die Welt einen schnelleren Klimawandel erlebt als erwartet,Landmark Paris Agreement set a path to slow warming. The world hasn't stayed on it. The world has seen faster climate change than expected since the Paris Agreement a decade ago,Terminum Paris Pactum iter ad tardus calefactionem posuit. Mundus in eo non mansit. Mundus citius mutationem climatis vidit quam expectari post pactum Parisiense decennium,2025-10-24 08:10:13+00:00
873eedde24a85c484917c650764ba5e0,2025-11-09T16:23:48Z,'+heat climate change',apnews.com,en,0.1,"In 10 years since Paris climate agreement, progress on warming but not nearly enough",The world has seen faster climate change than expected since the Paris Agreement a decade ago. Scientists say Earth's warming has outpaced efforts to reduce fossil fuel pollution that came out of the 2015 accord. This issue will be a focus of this week's UN c…,https://apnews.com/article/climate-negotiations-agreement-paris-brazil-warming-harms-d56626cd6f7f1f8e5c1a9afbde9d5198,https://dims.apnews.com/dims4/default/80eb479/2147483647/strip/true/crop/5773x3247+0+301/resize/1440x810!/quality/90/?url=https%3A%2F%2Fassets.apnews.com%2Fbd%2Fe0%2Ffbefef990c19e3982a181eb5284a%2F4e44a61e512843e48d94d05deffa8741,,"The world has changed dramatically in the decade since leaders celebrated a historic climate agreement in Paris a decade ago, but not quite in ways they expected or wanted. 
Earths warming climate h… [+6773 chars]",,"In den zehn Jahren seit dem Pariser Klimaabkommen gab es zwar Fortschritte bei der Erwärmung, aber bei weitem nicht genug. Seit dem Pariser Abkommen vor einem Jahrzehnt hat die Welt einen schnelleren Klimawandel erlebt als erwartet. Wissenschaftler sagen, dass die Erwärmung der Erde die Bemühungen zur Reduzierung der Verschmutzung durch fossile Brennstoffe im Rahmen des Abkommens von 2015 übertroffen hat. Dieses Thema wird ein Schwerpunkt der UN-Konferenz dieser Woche sein.","In 10 years since Paris climate agreement, progress on warming but not nearly enough. The world has seen faster climate change than expected since the Paris Agreement a decade ago. Scientists say Earth's warming has outpaced efforts to reduce fossil fuel pollution that came out of the 2015 accord. This issue will be a focus of this week's UN c…","In conventione climatis Parisiensi 10 annis, progressus in calefactione, sed non fere satis est. Mundus citius mutationem climatis vidit quam expectari post decennium pacti Parisiensis. Scientistae dicunt calefactionem Telluris nisum esse deminuendi fossilium escarum pollutionis quae ex 2015 unanimiter venit. Hic exitus focus huius hebdomadis erit IR c…",2025-10-24 08:10:13+00:00
a1f065ea21b4dcbf3297df8eae84be4e,2025-11-09T16:58:00Z,'+heat climate change',news.sky.com,en,0.1,Starmer avoided political heat at home during Brazil climate conference - but he returns to a prisons crisis,The prime minister comes back from the COP talks as his government struggles to deal with the fallout from a spate of wrongly-released prisoners and his colleagues' unconvincing attempts to reassure the public.,https://news.sky.com/story/starmer-avoided-political-heat-at-home-during-brazil-climate-conference-but-he-returns-to-a-prisons-crisis-13467463,https://e3.365dm.com/25/11/1600x900/skynews-sir-keir-starmer-prime-minister_7077200.jpg?20251109171609,,"Sir Keir Starmer's been on the other side of the world for most of the week - at the COP30 climate summit in Brazil, his 40th foreign trip in 16 months.
Back home, his government's credibility has c… [+4952 chars]",,"Starmer vermied den politischen Aufruhr zu Hause während der brasilianischen Klimakonferenz – aber er kehrt in eine Gefängniskrise zurück. Der Premierminister kommt von den COP-Gesprächen zurück, während seine Regierung mit den Folgen einer Flut unrechtmäßig freigelassener Gefangener und den wenig überzeugenden Versuchen seiner Kollegen, die Öffentlichkeit zu beruhigen, zu kämpfen hat.",Starmer avoided political heat at home during Brazil climate conference - but he returns to a prisons crisis. The prime minister comes back from the COP talks as his government struggles to deal with the fallout from a spate of wrongly-released prisoners and his colleagues' unconvincing attempts to reassure the public.,Starmer vitavit calorem politicum domi in colloquio climatis in Brasilia - sed redit ad discrimen carcerum. Primus minister ex COP colloquitur ut suum regimen moliatur agere cum defectione a spacio captivorum male dimissi et insuaves conatum collegarum ad confirmandos publicos.,2025-10-24 08:10:13+00:00
06916c2dc39b2640060cc832f8691659,2025-11-09T17:00:05Z,'heat stroke',bringatrailer.com,en,0.1,1986 Honda Z50RD Christmas Special at No Reserve,"This 1986 Honda Z50RD Christmas Special is a limited-edition model that was produced for one year only and was distributed in pairs to top Honda US dealerships. The RD is based on the Z50R, and all Christmas Special examples feature a chrome-plated finish wit…",https://bringatrailer.com/listing/1986-honda-z50rd-38/,https://bringatrailer.com/wp-content/uploads/2025/10/1986_honda_z50rd_dscf4508-36478.jpg,,"This 1986 Honda Z50RD Christmas Special is a limited-edition model that was produced for one year only and was distributed in pairs to top Honda US dealerships. The RD is based on the Z50R, and all C… [+1777 chars]",,"1986 Honda Z50RD Weihnachtsangebot ohne Reserve. Bei diesem Honda Z50RD Christmas Special von 1986 handelt es sich um ein Modell in limitierter Auflage, das nur ein Jahr lang produziert und paarweise an Top-Honda-Händler in den USA verteilt wurde. Der RD basiert auf dem Z50R und alle Christmas Special-Exemplare verfügen über eine verchromte Oberfläche mit…","1986 Honda Z50RD Christmas Special at No Reserve. This 1986 Honda Z50RD Christmas Special is a limited-edition model that was produced for one year only and was distributed in pairs to top Honda US dealerships. The RD is based on the Z50R, and all Christmas Special examples feature a chrome-plated finish wit…","1986 Honda Z50RD Nativitas Domini Special ad No Subsidium. Hoc 1986 Honda Z50RD Nativitatis Praecipuum exemplar est limitata-editio, quae uno tantum anno producta est et in paria distributa est ad mercaturam US Honda. RD in Z50R innititur, et omnia Nativitatis specialia exempla inducunt in chromate inaurata ingenii consummati...",2025-10-24 08:10:13+00:00
a62d27b528e5fec9837453c45be797b8,2025-11-09T17:30:07Z,'heat stroke',bringatrailer.com,en,0.1,1970 Yamaha AT1 Enduro 125 at No Reserve,"This 1970 Yamaha AT1 Enduro 125 was acquired by seller in 2019, reportedly from its second owner. Work in 2020 include refinishing the bike in yellow with silver fenders, refreshing the 123cc two-stroke single, overhauling the carburetor, and replacing the ba…",https://bringatrailer.com/listing/1970-yamaha-at1-enduro-125-4/,https://bringatrailer.com/wp-content/uploads/2025/11/1970_yamaha_at1-enduro-125_img_5506-54775.jpg,,"This 1970 Yamaha AT1 Enduro 125 was acquired by seller in 2019, reportedly from its second owner. Work in 2020 include refinishing the bike in yellow with silver fenders, refreshing the 123cc two-str… [+2259 chars]",,"1970 Yamaha AT1 Enduro 125 ohne Reserve. Diese Yamaha AT1 Enduro 125 aus dem Jahr 1970 wurde 2019 vom Verkäufer erworben, angeblich von ihrem zweiten Besitzer. Zu den Arbeiten im Jahr 2020 gehören die Überarbeitung des Motorrads in Gelb mit silbernen Kotflügeln, die Auffrischung des 123-cm³-Zweitakt-Einzelmotors, die Überholung des Vergasers und der Austausch des Ba…","1970 Yamaha AT1 Enduro 125 at No Reserve. This 1970 Yamaha AT1 Enduro 125 was acquired by seller in 2019, reportedly from its second owner. Work in 2020 include refinishing the bike in yellow with silver fenders, refreshing the 123cc two-stroke single, overhauling the carburetor, and replacing the ba…","1970 Yamaha AT1 Enduro 125 in Subsidium No. Hoc 1970 Yamaha AT1 Enduro 125 vendito anno 2019 acquisitum est, parem ab altero possessore suo. Opus anno 2020 includere cursoriam flavam cum patinis argenteis reficiens, reficiendo 123cc duos plagas simplices, carburetorem immittens et reposuit ba…",2025-10-24 08:10:13+00:00
845215ed22d07ae590e5b8c10c882150,2025-11-09T17:32:35Z,'+heat climate change',www.breitbart.com,en,0.1,BBC to Launch Investigation Into Bias in Climate Change Coverage: Report,"The BBC is reportedly set to conduct an investigation into its coverage of climate change, as the public broadcaster faces a credibility crisis on multiple fronts.
The post BBC to Launch Investigation Into Bias in Climate Change Coverage: Report appeared firs…",https://www.breitbart.com/europe/2025/11/09/bbc-to-launch-investigation-into-bias-in-climate-change-coverage-report/,https://media.breitbart.com/media/2025/11/GettyImages-1175337781-2-640x335.jpg,http://web.archive.org/web/20251110123109/https://www.breitbart.com/europe/2025/11/09/bbc-to-launch-investigation-into-bias-in-climate-change-coverage-report/,"The BBC is reportedly set to conduct an investigation into its coverage of climate change, as the public broadcaster faces a credibility crisis on multiple fronts.
In the wake of accusations of spre… [+3101 chars]",,"BBC leitet Untersuchung zu Verzerrungen in der Berichterstattung über den Klimawandel ein: Bericht. Berichten zufolge wird die BBC eine Untersuchung ihrer Berichterstattung über den Klimawandel durchführen, da der öffentlich-rechtliche Sender an mehreren Fronten mit einer Glaubwürdigkeitskrise konfrontiert ist.
Der Beitrag BBC leitet Untersuchung der Verzerrung in der Berichterstattung über den Klimawandel ein: Bericht erschien zuerst…","BBC to Launch Investigation Into Bias in Climate Change Coverage: Report. The BBC is reportedly set to conduct an investigation into its coverage of climate change, as the public broadcaster faces a credibility crisis on multiple fronts.
The post BBC to Launch Investigation Into Bias in Climate Change Coverage: Report appeared firs…","BBC ad Duc investigationem in Bias in Clima Mutationem Coverage: Report. BBC nuntiavit quaestionem in coverage de mutatione climatis deducendam esse, sicut palam latius palam discrimine credibilitatem in multiplicibus frontibus respicit.
Post BBC ad Duc investigatione in Bias in Clima Mutationem Coverage: Report apparuit abietes ...",2025-10-24 08:10:13+00:00
721ae29b62e48d77b98230e91fa6c121,2025-11-09T19:28:42Z,'+heat climate change',phys.org,en,0.1,Landmark Paris Agreement set a path to slow warming. The world hasn't stayed on it,"The world has changed dramatically in the decade since leaders celebrated a historic climate agreement in Paris a decade ago, but not quite in ways they expected or wanted.",https://phys.org/news/2025-11-landmark-paris-agreement-path-world.html,https://scx2.b-cdn.net/gfx/news/hires/2025/landmark-paris-agreeme.jpg,,"The world has changed dramatically in the decade since leaders celebrated a historic climate agreement in Paris a decade ago, but not quite in ways they expected or wanted.
Earth's warming climate h… [+7751 chars]",,"Das wegweisende Pariser Abkommen hat den Weg zur Verlangsamung der Erwärmung geebnet. Die Welt ist nicht dabei geblieben. Die Welt hat sich in dem Jahrzehnt, seit die Staats- und Regierungschefs vor einem Jahrzehnt in Paris ein historisches Klimaabkommen feierten, dramatisch verändert, aber nicht ganz in der Weise, wie sie es erwartet oder gewollt hatten.","Landmark Paris Agreement set a path to slow warming. The world hasn't stayed on it. The world has changed dramatically in the decade since leaders celebrated a historic climate agreement in Paris a decade ago, but not quite in ways they expected or wanted.","Terminum Paris Pactum iter ad tardus calefactionem posuit. Mundus in eo non mansit. Mundus dramatice mutatus est in decenniis cum principes conventionem climatis historicam Lutetiae decennium celebraverunt, sed non satis per vias exspectaverunt vel desideraverunt.",2025-10-24 08:10:13+00:00
120630ffc966381e2d03cee4d9392cde,2025-11-09T21:50:08Z,'heat stroke',bringatrailer.com,en,0.1,1968 Honda Z50A Mini Trail at No Reserve,"This 1968 Honda Z50A Mini Trail was reportedly used for over two decades by a prior owner as a pit bike, until ownership passed to the current owner in 2024. A subsequent refurbishment completed in 2025 included refinishing the bike in yellow and white, repla…",https://bringatrailer.com/listing/1968-honda-z50a-mini-trail-22/,https://bringatrailer.com/wp-content/uploads/2025/10/1968_honda_z50a-mini-trail_1000007968-88260.jpg,,"This 1968 Honda Z50A Mini Trail was reportedly used for over two decades by a prior owner as a pit bike, until ownership passed to the current owner in 2024. A subsequent refurbishment completed in 2… [+2062 chars]",,"1968 Honda Z50A Mini Trail ohne Reserve. Berichten zufolge wurde dieser Honda Z50A Mini Trail aus dem Jahr 1968 von einem Vorbesitzer über zwei Jahrzehnte lang als Pitbike genutzt, bis er 2024 in den Besitz des jetzigen Besitzers überging. Eine anschließende, im Jahr 2025 abgeschlossene Renovierung umfasste die Neulackierung des Motorrads in Gelb und Weiß, die Erneuerung …","1968 Honda Z50A Mini Trail at No Reserve. This 1968 Honda Z50A Mini Trail was reportedly used for over two decades by a prior owner as a pit bike, until ownership passed to the current owner in 2024. A subsequent refurbishment completed in 2025 included refinishing the bike in yellow and white, repla…","1968 Honda Z50A Mini Trail ad No Subsidium. Hoc 1968 Honda Z50A Mini Trail in duobus decenniis a priore possessore tamquam foveae cursoriae parem usus est, donec dominium ad possessorem currentem anno 2024. Transivit sequens refurbisma anno 2025 peracta inclusa repla cursorii in flavum et album.",2025-10-24 08:10:13+00:00
574bcf7196d75846e80cdb537d974746,2025-11-09T22:00:00Z,'+heat climate change',wattsupwiththat.com,en,0.1,UK Regulator Proposes Energy Companies Use RCP8.5 for Stress Testing Climate Impacts,A public writ for resource misallocation and higher British energy bills.,https://wattsupwiththat.com/2025/11/09/uk-regulator-proposes-energy-companies-use-rcp8-5-for-stress-testing-climate-impacts/,https://i0.wp.com/wattsupwiththat.com/wp-content/uploads/2025/06/image-53-1.png?fit=940%2C584&quality=75&ssl=1,,"Essay by Eric Worrall
h/t strativarius, Daily Skeptic – A public writ for resource misallocation and higher British energy bills.
Consultation
ED3 Sector Specific Methodology Consultation Climate … [+8155 chars]",,"Britische Regulierungsbehörde schlägt Energieunternehmen vor, RCP8.5 für Stresstests der Klimaauswirkungen zu verwenden. Eine öffentliche Klage wegen Fehlallokation von Ressourcen und höheren britischen Energierechnungen.",UK Regulator Proposes Energy Companies Use RCP8.5 for Stress Testing Climate Impacts. A public writ for resource misallocation and higher British energy bills.,UK Regulator proponit Energy Companies Usus RCP8.5 pro Suspendisse Testis Clima Impacts. Breve publicum pro subsidio misallocationis et altioris energiae Britannicae rogationum.,2025-10-24 08:10:13+00:00
42f93c98d51e86fd3c01927a05ff7917,2025-11-10T00:00:00Z,'+heat climate change',www.nature.com,en,0.1,Deep connections: exploring the genetic connectivity of mesophotic and shallow-water populations of the sponge Axinella polypoides,Scientific Reports - Deep connections: exploring the genetic connectivity of mesophotic and shallow-water populations of the sponge Axinella polypoides,https://www.nature.com/articles/s41598-025-18563-0,https://media.springernature.com/m685/springer-static/image/art%3A10.1038%2Fs41598-025-18563-0/MediaObjects/41598_2025_18563_Fig1_HTML.png,,"<li>Coll, M. et al. The biodiversity of the mediterranean sea: estimates, patterns, and threats. PLoS One. 5, 8 (2010).
Article 
Google Scholar 
</li><li>Albano, P. G. et al. The dawn of the tropi… [+19958 chars]",,Tiefe Verbindungen: Erforschung der genetischen Konnektivität mesophotischer und Flachwasserpopulationen des Schwamms Axinella polypoides. Wissenschaftliche Berichte – Tiefe Verbindungen: Erforschung der genetischen Konnektivität mesophotischer und Flachwasserpopulationen des Schwamms Axinella polypoides,Deep connections: exploring the genetic connectivity of mesophotic and shallow-water populations of the sponge Axinella polypoides. Scientific Reports - Deep connections: exploring the genetic connectivity of mesophotic and shallow-water populations of the sponge Axinella polypoides,Vincula profundissima: explorans connectivity geneticae mesophoticae et vadosae incolarum spongiae Axinellae polypoides. Renuntiationes scientificae - Vincula profundissima: connectivity geneticae mesophoticae et vadosae incolarum spongiae axinellarum polypoides explorans.,2025-10-24 08:10:13+00:00
